{
  "schema": "https://libraryos.dev/schemas/collection/v1",
  "schema_version": 1,
  "id": "quantum-sensing-reading-list",
  "title": "Quantum sensing reading list",
  "description": "A non-biomedical collection used to enforce domain neutrality.",
  "kind": "reading-list",
  "status": "active",
  "policy": {
    "citation_requires_local_source": false
  },
  "members": [
    {
      "work": {
        "identifier": {
          "scheme": "arxiv",
          "value": "2401.01234",
          "normalized": "2401.01234",
          "status": "verified"
        }
      },
      "order": 10,
      "priority": "background",
      "disposition": "read-next",
      "tags": ["quantum-sensing"]
    }
  ],
  "outputs": [
    {
      "kind": "bibtex",
      "path": "references.bib"
    }
  ]
}
